{
  "version": "1.0",
  "module": "CFF",
  "updated": "2026-04-23T00:00:00Z",
  "title": "Cash Flow Forensics",
  "description": "Measures funding alignment, flagged use, and authorized-versus-actual divergence across monitored funding streams. CFF conditions later recovery and integration layers without replacing the pioneer spine.",
  "weights": {
    "appropriation_fidelity": 0.34,
    "use_fidelity": 0.33,
    "traceability_fidelity": 0.33
  },
  "thresholds": {
    "good": 0.85,
    "warning": 0.65
  },
  "funding_streams": [
    {
      "stream_id": "mcsap_like_01",
      "program_name": "Illustrative MCSAP-style grant stream",
      "authorized_use_usd": 5000000,
      "actual_use_usd": 6400000,
      "appropriation_fidelity": 0.45,
      "use_fidelity": 0.35,
      "traceability_fidelity": 0.55,
      "notes": "Illustrative overreach example where actual use exceeds authorized mission scope."
    },
    {
      "stream_id": "transport_enforcement_02",
      "program_name": "Illustrative traffic enforcement allocation",
      "authorized_use_usd": 2800000,
      "actual_use_usd": 3600000,
      "appropriation_fidelity": 0.55,
      "use_fidelity": 0.40,
      "traceability_fidelity": 0.50,
      "notes": "Illustrative drift example showing mission stretch and traceability weakness."
    },
    {
      "stream_id": "civil_admin_03",
      "program_name": "Illustrative civil administrative support stream",
      "authorized_use_usd": 1900000,
      "actual_use_usd": 2100000,
      "appropriation_fidelity": 0.78,
      "use_fidelity": 0.72,
      "traceability_fidelity": 0.80,
      "notes": "Illustrative partial variance with moderate traceability."
    }
  ]
}
